מקור,שאלה,תשובה 1,תשובה 2,תשובה 3,תשובה 4,תשובה 5,תשובה 6,תשובות נכונות,נושא,חשיבות לסדר,קישור לתמונה,הערות
שחזורים 2019 - מועד א',על מה ביסס דרווין את התיאורה שלו?,חקר מאובנים (פלאונטולוגיה),חקר מדעי כדור הארץ (גאולוגיה),על בסיס התיאורה של למרק,א+ב+ג,,,4,Evolution and Genomics,TRUE,,
שחזורים 2019 - מועד א',מה ההבדל בין דרווין למרק?,למרק דיבר על תכונות נרכשות,התיאורה של למרק אינו אבולוציה,התיאוריה של דרווין היא על אבולוציה של 7500 שנים בלבד.,א+ב,,,1,Evolution and Genomics,TRUE,,
שחזורים 2019 - מועד א',אילו מההיגדים הבאים מייצגים שינויים אבולוציוניים?,שחיקה של הר לאורך זמן,נפילתם של עלי השלכת,עמידות לאנטיביוטיקה בחיידקים,ב+ג,א+ב+ג,,3,Evolution and Genomics,TRUE,,
שחזורים 2019 - מועד א',איזה מהתנאים הבאים מונע לחלוטין ברירה טבעית באוכלוסיות לאורך זמן,שונות בין פרטים רק בגורמים סביבתיים,קיום של מעבר גנטים הוריזונטלי,גודל האוכלוסייה משתנה עם הזמן,אוכלוסיה החיה בבית גידול ללא מתחרים,אוכלוסיה עם קצב מוטציה גבוה,,1,Evolution and Genomics,FALSE,,
שחזורים 2019 - מועד א',בעקבות ההתחממות הגלובלית שפני סלע עברו סלקציה מייצבת. נצפה ש:,השונות הגנטית תקטן,השונות הגנטית תגדל,לא נראה שינוי,לא ניתן לדעת,,,1,Evolution and Genomics,FALSE,,
שחזורים 2019 - מועד א',מה הוא סחף גנטי ?,שינוי אקראי בשכיחות האללים באוכלוסיה כתוצאה מאוכלוסיה גדולה,שינוי אקראי בשכיחות האללים באוכלוסיה כתוצאה מאוכלוסיה קטנה,היעדר שינוי בשכיחות האללים כתוצאה מאוכלוסיה גדולה,היעדר שינוי בשכיחות האללים כתוצאה מאוכלוסיה קטנה,,,2,Evolution and Genomics,FALSE,,
שחזורים 2019 - מועד א',משפחה מרובת גנים (Multigene) מורכבת מ:,גנים אשר תוצרי החלבון שלהם זהים אחד לשני,"עותקים מרובים של גנים דומים שכנראה נוצרו ע""י שכפול",חזרות של רצפי DNA כמו אלו הנמצאים בדנטומרים וטטומרים,גן שהאקסון שלו יכול להחתך בכמה דרכים,גן שמור שמור מאוד שמופיע במספר מינים שונים,,2,Evolution and Genomics,FALSE,,
שחזורים 2019 - מועד א',"אוכלוסיית חתולי רחוב יש פרטים שחורים וחומים בלבד. הגנוטיפ החום הוא רצסיבי aa, הגנוטיפ השחור הוא דומיננטי AA. דגמת אוכלוסייה של 1000 פריטים וגילית ששחיכות האלל החום היא 36%. מה שכיחות האלל A? 
",36%,72%,60%,40%,18%,,4,Evolution and Genomics,FALSE,,
שחזורים 2019 - מועד א',"לבן אדם 30,000 Mb, לשושן 12,00 Mb ולשמר 13 Mb. מדוע מהאינפורמציה הזאת אי אפשר להסיק יחסים אבולוציונים?",יחסים אבולוציונים מבוססים על מספר גנים ולא על כמות דנ״א.,יחסים אבולוציונים מבוססים על צפיפות גנים.,"יחסים אבולוציונים מבוססים על דמיון בין רצפים שמקודדים לחלבון, לא כל הגנים.",יחסים אבולוציוניים מבוססים על כמות רצפים חוזריים של דנ״א.,אפשר להסיק לגבי דמיון אבולוציוני רק כשהפרטים הם מאותה האוכלוסיה.,,3,Evolution and Genomics,FALSE,,
שחזורים 2019 - מועד א',ממה Multigenes מורכבים?,תוצרי חלבון זהים,עותקים של גנים דומים ששוכפלו,"חזרות של רצפי דנ""א",אקסונים נחתכים בצורות שונות,,,2,Evolution and Genomics,FALSE,,
שחזורים 2019 - מועד א',איזה מהמסיחים הבאים תומך בתיאורית ה-RNA World?,הRNA משמש כחומר גנטי.,"הRNA משמש לקטליזה, כלומר משמש כאנזים.",קיימת סלקציה טבעית לטובת RNA המסוגל לשכפל את עצמו.,א'+ב'+ג',,,4,Evolution and Genomics,TRUE,,
שחזורים 2019 - מועד א',"מה היתה תרומתם של חיידקים מבצעי פוטוסינתזה לכדה""א כפי שאנו מכירים אותו כיום?","ניצלו את אנר' השמש לביצוע פוטוסינתזה ובכך הורידו את טמפ' כדה""א",לפי התאוריה האנדוסימביוזית בלעו תא אחר והיוו אב קדמון לאאוקריוטים,החומר הגנטי שלהם היה RNA קדום שממנו התפתח הDNA,חיו על שורשים של צמחים ומאפשרים קבלת נוטריינטים מהאדמה,"הם מקבעים פחמן דו חמצני ומשחררים חמצן שהכרחי לקיום הרבה מיני בע""ח היום",,5,Evolution and Genomics,FALSE,,
שחזורים 2019 - מועד א',(ציור של עץ פילוגנטי) לפי האיור מה ניתן ללמוד על הcambrian explosion?,גרם להכחדה המונית.,אחריו נוצרו מינים מגוונים בעקבות יחסי טורף נטרף.,בעקבותיו נוצרו יצורים רב תאיים.,נוצרו ציפורים ויצורים קטנים ששרדו טוב יותר מאורגניזמים גדולים.,אחריו הייתה עליה מהים ליבשה.,,-2,Evolution and Genomics,FALSE,,
שחזורים 2019 - מועד א',מה היתה הבדיקה לדעת מה הגיל של מאובן :,דעיכה של איזוטופ רדיואקטיבי,בדיקת שלמות המאובן,השוואת צורת המאובן לשלדים קיימים ומוכרים,ריצוף הדנא של המאובן והשוואתו לדנא של יצורים החיים כיום,הערכה של כמות החמצן האגורה במאובן,,1,Evolution and Genomics,FALSE,,
שחזורים 2019 - מועד א',מה ההבדל בין נגיף (וירוס) לבין תא ?,"תא מכיל חומר גנטי, לנגיף אין חומר גנטי","לתא יש פולימראז שמעתיק דנא, לנגיף אין פולימראז שמעתיק דנא","לתא יש יכולת עצמאית לתרגם מידע גנטי לחלבון, לנגיף אין יכולת לתרגם מידע גנטי לחלבון","תא עובר אבולוציה, נגיף לא.",ב+ג,א+ב+ג,3,The Diversity of Life,TRUE,,
שחזורים 2019 - מועד א',עמידות הנגיפים לתרופה נגד HIV,סלקציה לטובת וירוסים שיש להם עמידות לתרופה,סלקציה נגד וירוסים שהתרופה נקשרה אליהם,צוואר בקבוק וסחף גנטי הביאו לשינוי באוכלוסיה,א+ב,א+ב+ג,,4,The Diversity of Life,TRUE,,
שחזורים 2019 - מועד ב',מה ניתן ללמוד מהאיור לפי מה שנלמד בשיעור?,מאובן ב' עתיק ממאובן א',ככל שהשכבה עליונה יותר היא צעירה יותר,ניתן למצוא מאובנים בכל שכבות הקרקע,א+ב+ג,,,,Evolution and Genomics,TRUE,https://i.imgur.com/7OdqYsD.png,
שחזורים 2019 - מועד ב',מה מסבירה התיאוריה של דארווין?,את הדמיון בין כל החיים,את ההבדלים בין כל הפרטים החיים,את ההתאמות של אורגניזמים לסביבתם,א+ב+ג נכונות,,,4,Evolution and Genomics,TRUE,,
שחזורים 2019 - מועד ב',"בדרום ישראל, ציפורים רבות ניזונות מנמלים לבנים, אפורים ושחורים בשנים האחרונות צבע החול הופך להיות אפור/שחור עקב זיהום, מה שמאפשר לנמלים מסוימות הסוואה איזו סלקציה סביר שתפעל על הנמלים?",סלקציה כיוונית directional selection,סלקציה מייצבת stabilizing selection,סלקציה משבשת disruptive selection,סלקציה מואצת accelerated selection,סלקציה מואטת decelerated selection,,1,Evolution and Genomics,FALSE,,
שחזורים 2019 - מועד ב',"בשדה של צמחי בר יש מינים שונים של פרחים. מבדיקה שנערכה התגלה כי יש בשדה 5000 פרטים של כלנית ו-500 פרטים של רקפת. בהיעדר סלקציה, מה מהמשפטים הבאים סביר ביותר?","עם הזמן יש סיכוי שיחולו שינויים בשכיחויות אללים שונים באוכלוסיית הכלנית, אך סיכוי זה קטן יותר באוכלוסיית הרקפת.","עם הזמן יש סיכוי שיחולו שינויים בשכיחויות אללים שונים באוכלוסיית הרקפת, אך סיכוי זה קטן יותר באוכלוסיית הכלנית.",נצפה ששתי האוכלוסיות יהיו בשיווי משקל הרדי ויינברג.,נצפה שאוכלוסיית הכלנית תהיה בשיווי משקל הרדי ויינברג.,נצפה שאוכלוסיית הרקפת תהיה בשיווי משקל הרדי ויינברג.,,2,Evolution and Genomics,FALSE,,
שחזורים 2019 - מועד ב',בתירס יש גם צהובים וגם סגולים בשווי משקל של משוואת הארדי וויינברג. דגמת מאוכלוסיה של 100 פריטים ויצא ש-91 היו סגולים והיתר צהובים. מה השכיחות של האלל צהוב?,0.09,0.3,0.49,0.7,,,,Evolution and Genomics,FALSE,,
שחזורים 2019 - מועד ב',ביצעת בדיקת לגנים של תורם זרע וגילת כי מספר המוטציות בתאי הזרע רב יותר מבתאי העור. מה ההסבר ההגיוני?,המוטציות בתאי הזרע קיימות בכדי לבצע הפרייה טובה יותר עם הביצית,המוטציות כנראה יהיו נייטרליות או מזיקות,רוב המוטציות ברצפים שמקודדים לגנים,רוב המוטציות ברצפים שלא מקודדים לגנים,א+ג,ב+ד,6,Evolution and Genomics,TRUE,,
שחזורים 2019 - מועד ב',"במאה ה19 הייתה אוכלוסיות דרקונים גדולה שבעקבות צייד המוני הצטמצמה בשנות ה20. עקב חוקים שאוסרים על ציד גדלה אוכ' הדרקונים שוב, מה סביר שיקרה?",האוכ מגוונת גנטית,השונות הגנטית באוכ קטנה,יש סלקציה לטובת פריטים הטרוזיגוטים,האוכ תהיה חסינה למגוון מחלות שונות,,,2,Evolution and Genomics,FALSE,,
שחזורים 2019 - מועד ב',מה נכון לגבי פרוקריוטים?,,,הם אחראים לבערך כרבע מייצור החמצן,,,,,Evolution and Genomics,FALSE,,
שחזורים 2019 - מועד ב',"אורכו של הגנום של בני אדם 3 מליון בסיסים ויש לו רק 20000 גנים, ואילו לעכבר יש 15 בסיסים ו 50000 גנים אך אדם נחשב מורכב יותר מעכבר מה מסביר זאת?","בדנ""א של אדם יש הרבה אזורים לא מקודדים",אין הגדרה מדויקת למה נחשב אורגניזם מורכב יותר,א+ב נכונים,,,,3,Evolution and Genomics,FALSE,,
שחזורים 2019 - מועד ב',איזה גזים לא היו לפני באטמוספירה לפני הופעתם של יצורים שעושים פוטוסינתזה?,חמצן,פחמן דו חמצני,פחמן חד חמצני,חנקן,מתאן,,1,Evolution and Genomics,FALSE,,
שחזורים 2019 - מועד ב',מה נכון בנוגע לתיארוך של מאובנים,אפשר לתארך תיארוך לא מדויק על ידי השוואה בין מאובן בשכבת סלע לעומת מאובן בשכבה אחרת.,. תארוך מדויק על ידי פחמן 14 או איזוטופ רדיואקטיבי אחר על פי זמן מחצית החיים שלהם.,על פי מצב החמצן בסלע כי החמצן עולה באטמוספירה כל הזמן החל מלפני 4 שנים.,. א + ב,. א + ב + ג,,4,Evolution and Genomics,TRUE,,
שחזורים 2019 - מועד ב',מחזור החיים ליזוגני ( lysogenic life cycle) כולל:,ליזיס מוקדם של התא המארח,שלב של רברס טרנסקריפציה,פרו פאג' prophage,"שלב של הרס דנ""א המארח","שלב של אריזה של דנ""א מארי בתוך קפסיד של פאג' חדש הנארז",,,The Diversity of Life,FALSE,,
שחזורים 2019 - מועד ב',מה דרוש כדי שוירוס HIV יחדור לתא?,אנזים נוקלאזה,אנזים רוורס טרנסריפטאז,"רנ""א שפועל על דנ""א","דנ""א שפועל על דנ""א",א+ב נכונים,ב+ג נכונים,ב+ג+ד נכונים,The Diversity of Life,TRUE,,
שחזורים 2019 - מועד ב',מישהוא חרט את השם שלו על עץ בגובה 2 מטר ועץ מתארך מטר כל שנה אחרי 5 שנים איפה יהיה השם ?,7 מטר,2 מטר,,,,,2,Biology of Plants,FALSE,,
שחזורים 2019 - מועד ב',אכלתם מנה עם אורז מה צריך לאכול עוד כדי להשלים את … התזונתיים ?,תפוח אדמה,עדשים,שעורה,חיטה,,,2,Biology of Plants,FALSE,,
שחזורים 2019 - מועד ב',מה הסיבה שחיידקים יכולים לפתח עמידות לאנטיביוטיקה מהר,קצב מוטציה גבוה,קצת התרבות גבוהה,א+ב נכונות,,,,3,The Diversity of Life,TRUE,,
שחזורים 2019 - מועד ב',למה המים יורדים למעלה בעץ :,הפסי למעלה יותר שלילי,אדהזיה וקוהזיה,,,,,,Biology of Plants,FALSE,,
שחזורים 2019 - מועד ב',מה הכוח שמניע את המים מהשורשים עד לעלים?,פוטנציאל מים נמוך באיזור השורשים וגבוה באוויר שבא במגע עם העלים.,פוטנציאל מים גבוה באיזור השורשים ונמוך באוויר שבא במגע עם העלים.,כוחות אדהזיה וקוהזיה.,,,,2,Biology of Plants,FALSE,,
שחזורים 2019 - מועד ב',שאלה על צמחים כאשר קורה יצאת מים מהר :,הבועיות מדתחררות והצמח עלול למות,,,,,,,Biology of Plants,FALSE,,
שחזורים 2019 - מועד ב',מה ההבדל המרכזי בין חיידקים גרם-חיוביים וחיידקים גרם שליליים?,חיידקים גרם חיוביים טעונים חיובית וחיידקים גרם שלילית טעונים שלילי.,חיידקים גרם חיוביים נמצאים בשיווי משקל הרדי ווינברג וחיידקים גרם שליליים לא.,לחיידקים גרם חיוביים יש נטייה של מעבר גנטי LGT.,חיידקים גרם חיוביים גורמים למחלות וחיידקים גרם שליליים אינם גורמים למחלות.,חיידקים גרם חיוביים עוברים צביעת gram staining ושליליים אינם עוברים צביעה.,,,The Diversity of Life,FALSE,,
שחזורים 2019 - מועד ב',לפי מה הוחליטו שהחיים מחולקים ל 3 דומיינים- אוקריוטים אראכה ובקטריה?,לפי ספר שכתב .לינוס? .. שנת 1935,לפי רצף dna,לפי מיקרוסקופ אלקטרוני,על בסיס ההבחנה בנוכחות איברונים שונים בכל אחד מהאורגניזמים בדומיינים השונים,,,,The Diversity of Life,FALSE,,
שחזורים 2019 - מועד ב',מה מהבאים לא קיים בכל האאוקריוטים?,מיטוכונדריה,גרעין ומעטפת,כלורופלסט,ריבוזום,חומר גנטי,,3,The Diversity of Life,FALSE,,
שחזורים 2019 - מועד ב',מה מתאר האיור?,מיקרוזיה ארבוסקולרית,חזזית,יחסים של טפילות,א+ג נכונות,ב+ג נכונות,,-2,The Diversity of Life,TRUE,,
שחזורים 2019 - מועד ב',"בצמח בצל בן שנה, ערך הפסאי גבוה בהרבה בשורשים מאשר בנצר מהי תנועת הסוכרים:","א) סוכרים שנוצרים בעלים, יעלו אך ורק למעלה.","ב) סוכרים שנוצרים בעלים, יכולים לרדת למטה",ג)סוכרים לא יכולים לרדת למטה.,ד)סוכרים לא יכולים לעלות למעלה.,ה)אף תשובה אינה נכונה,,,Biology of Plants,FALSE,,
שחזורים 2019 - מועד ב',למי מנבאים אין מעי אלא חלל גסטרו וסקולרי?,תולעים שטוחות,קווצי עור,חולייתנים,,,,,The Diversity of Life,FALSE,,
שחזורים 2019 - מועד ב',מה משותף לחולייתנים?,,בעלי גולגולת,בעלי לסתות,בעלי חוליות,,,,The Diversity of Life,FALSE,,
שחזורים 2019 - מועד ב',"על נבט אטיולנטי שמכוסה בחלקו התחתון בשכבה אטומה, מאירים באור אדום מה יקרה לנבט?",הנבט לא יתכופף,הנבט יתכופף לכיוון האור,הנבט יתכופף לכיוון המנוגד לאור,"הנבט יתכופף, אך לא באותה מידה כמו שהיה מתכופף אם היה נחשף לאור לבן.",,,1,Biology of Plants,FALSE,,
שחזורים 2019 - מועד ב',"בעץ בננות מוטנט שחסר בו רצפטור לאתילן, מה סביר שיקרה?",הפירות לא יבשילו גם אם נקרב אותם לפירות של עץ בננות אחר.,הפירות יבשילו אם נרסס אותם באתילן.,הפירות יבשילו אם נקרב אותם לפרות של עץ בננות אחר.,,,,1,Biology of Plants,FALSE,,
שחזורים 2019 - מועד ב',מדוע צמח מוטנט שהפיוניות שלו פתוחות תמיד ימות מהר יותר?,מפני שטרנספירציה חזקה גורמת להיווצרות בועות במערכת ההובלה.,,,,,,1,Biology of Plants,FALSE,,
שחזורים 2019 - מועד ב',"התפתחות השלב הספורופיטי בצמח התאפשרה ע""י:","עיכוב חלוקת המיוזה של הזיגוטה, והתפתחותה בחלוקות מיטוטיות.",עיכוב חלוקת המיטוזה של הזיגוטה והתפתחותה בחלוקות מיוטית.,,,,,1,Biology of Plants,FALSE,,
שחזורים 2019 - מועד ב',"מצאו צמח בעל עוברים, מבצע פוטוסינתזה, ובעל מערכות הובלה אילו מבין קבוצות הצמחים הבאות הוא לא יכול להכלל בהן?",טחבים,שרכים,מכוסי זרע,חשופי זרע,אצות ירוקיות חד תאיות,,1,Biology of Plants,FALSE,,
שחזורים 2019 - מועד ב',מה הבאים הכי משפיע על ההתמיינות של תא מריסטמי?,המיקום שלו במריסטמה.,כיוון החלוקה של התא.,ביטול של גנים מסויימים,,,,1,Biology of Plants,FALSE,,
שחזורים 2019 - מועד ב',"איפה יתבטא גן מקבוצת ,C במוטנט שהוא הומוזיגוט לתקלה בגן מקבוצת A?",בכל איברי הפרח,בשחלות,באבקנים,,,,1,Biology of Plants,FALSE,,
שחזורים 2019 - מועד ב',על מה מצביע החץ הבא?,,,מריסטמה קודקודית,,מריסטמת תפרחת,מריסטמת הפרח,5,Biology of Plants,FALSE,,
שחזורים 2018 - מועד א',למה pcr לא מתבצע בטמפ החדר?,אין פולימרזות שפועלות ב25 מעלות,הליגאז בתהליך דורש טמפ גבוהה,הפרדת גדילי DNA דורשת טמפ גבוהה,בטמפ 25 מעלות לא תהיה הכפלה אקספוננציאלית,התהליך צריך להתבצע ב0 מעלות כדי שלא תהיה הפרדות גדילי dna,,3,Evolution and Genomics,FALSE,,
שחזורים 2018 - מועד א',מה נכון לגבי הכנה של דנא רקומיבנטורי?,משתמשים באותו אנזים רסטריקה גם לפלסמיד וגם לדנא כדי שיכירו אחד את השני בסטיקי אנס,משתמשים באנזים שונים,"לא משתמשים ברסטיריקציה, אלא ליגאז",לא משתמשים....?,משתמשים באנזים רסטריקציה כדי לחתוך לחתיכות קטנות.,,1,Evolution and Genomics,TRUE,,
שחזורים 2018 - מועד א',אילו מהדוגמאות הבאות מדגימות מטה-גנומיקה?,ריצוף של הגנום האנושי,ריצוף של עשרה מינים של פרפרים ממדינות שונות באירופה,ריצוף של אבולה מחולים באפריקה,ריצוף של כל קהילת החיידקים בביוב בישראל,ריצוף של חזיר הבר האסייתי,,4,Evolution and Genomics,FALSE,,
שחזורים 2018 - מועד א',איך נחפש גן ברצף חדש שרוצף?,קריאת 3 מסגרות קריאה ומציאת הגן הארוך ביותר שמתחיל בקודון האינציאציה ATG ומסתיים בקודון טרמינציה.,קריאת 6 מסגרות קריאה ומציאת הגן הארוך ביותר שמתחיל בקודון האינציאציה ATG ומסתיים בקודון טרמינציה.,קריאת 6 מסגרות קריאה ומציאת הגן הארוך ביותר שמתחיל בקודון האינציאציה ATG ומסתיים ב חומצה אמינית ארומטית.,קריאת מסגרת קריאה אחת החל מקודון האינטיאציה ועד קודון הטרמינציה.,"לא זוכרת במדויק, לא הייתה מסגרת קריאה, משהו על הגן הארוך ביותר.",,2,Evolution and Genomics,FALSE,,
שחזורים 2018 - מועד א',מדוע אין קורלציה/התאמה חיובית בין מספר הגנים בגנום לגודל הגנום?,ככל שהגנום גדול יותר מספר הגנים הם מעטים יותר וגדולים יותר.,בגנומים גדולים יש אובדן גדול של גנים כתוצאה מרקומבינציה.,בגלל סלקציה לטובת גנומים גדולים יותר באורגניזמים גדולים יותר ו/או מורכבים יותר.,בגלל פעילות של טרנספוזונים שמוציאים חומר גנטי ומקטינים את גודל הגנום.,גנומים רבים גדולים נושאים הרבה חומר לא מקודד non coding DNA,,5,Evolution and Genomics,FALSE,,
שחזורים 2018 - מועד א',ריצפתם גנים של שני יתושים ביתיים ומצאתם דמיון של 90% מה הסיבה ההגיונית ביותר לדמיון זה,אב קדמון משותף,דמיון מקרי אקראי,זרימת גנים אופקית,א וב יכולים להיות באותה מידה,,,1,Evolution and Genomics,FALSE,,
שחזורים 2018 - מועד א',עוברים של ציפור ודג דומים לעובר של אדם בהתחלה. על מה מעיד?,העובר עובר אבולוציה בזעיר אנפין (תוקן לסקאלה קטנה),חולקים אב קדמון משותף,יש יתרון להיות דומה לעובר אנושי (סלקצייה חיובית?),עוד שטות שהם המציאו.,,,2,Evolution and Genomics,FALSE,,
שחזורים 2018 - מועד א',"מה מייצג את שכיחות ההטרוזיגוטים באוכלוסייה, על פי משוואת הרדי וינברג:",P^2,Q^2,2pq,P^2+2pq,Q^2+2pq,,3,Evolution and Genomics,FALSE,,
שחזורים 2018 - מועד א',"השכיחות של אלל A היא 0.6, והשכיחות של אלל a היא 0.4. מהי השכיחות של הטרוזיגוטיים בעלי גנוטיפ Aa?",0.48,0.24,0.6,0.4,1,,1,Evolution and Genomics,FALSE,,
שחזורים 2018 - מועד א',כשרוצים להעביר דנא מחיידק (אולי וירוס?) אחד לאחר- מה נכון:,יש להשתמש באותו אנזים רסטריקציה שיחתוך את הדנא החדש והמקורי,יש להשתמש באנזים רסטריקציה שונה לשניהם,,,,,,Evolution and Genomics,FALSE,,
שחזורים 2018 - מועד א',מה מההיגדים מתאר את ההבדלים בתפיסתם של דרווין ולמרק את האבולוציה?,למרק האמין שתכונות נרכשות מועברות בתורשה.,למרק האמין כי צוואר הג׳ירפה ארוך משום שלאורך חיים הפרט מותח את צווארו ומוריש תכונה זאת לצאצאיו.,"למרק האמין שפריטים בעלי תכונות מורשות המעלות את שרידותם, יעמידו יותר צאצאים.",א+ב,א+ב+ג,,4,Evolution and Genomics,TRUE,,
